,Generator Score,Discriminator Score
Reconstruction Score All,0.717771093488895,0.717771093488895
Reconstruction Score Structural,0.9296272115565594,0.9296272115565594
Reconstruction Score Attribute,0.4922827496757458,0.4922827496757458
Mean Diff Score All,0.5236061738522773,0.46573238537963724
Mean Diff Score Structural,0.5213509316770186,0.42992718332392243
Mean Diff Score Attribute,0.5233434839000733,0.5035808943777139
Mean Diff Score All Reverse,0.4763938261477228,0.5342676146203628
Mean Diff Score Structural Reverse,0.4786490683229814,0.5700728166760776
Mean Diff Score Attribute Reverse,0.4766565160999267,0.49641910562228614
